{
  "$schema": "https://json-schema.org/draft/2020-12/schema",
  "$id": "https://epistola.app/schemas/catalog-manifest-v7.schema.json",
  "title": "CatalogManifest",
  "description": "Portable Epistola catalog manifest at wire version 7.",
  "type": "object",
  "properties": {
    "schemaVersion": {
      "const": 7
    },
    "catalog": {
      "$ref": "#/$defs/CatalogInfo"
    },
    "publisher": {
      "$ref": "#/$defs/PublisherInfo"
    },
    "release": {
      "$ref": "#/$defs/ReleaseInfo"
    },
    "compatibility": {
      "oneOf": [
        {
          "$ref": "#/$defs/CompatibilityInfo"
        },
        {
          "type": "null"
        }
      ]
    },
    "includes": {
      "oneOf": [
        {
          "type": "array",
          "items": {
            "$ref": "#/$defs/IncludeEntry"
          }
        },
        {
          "type": "null"
        }
      ]
    },
    "resources": {
      "type": "array",
      "items": {
        "$ref": "#/$defs/ResourceEntry"
      }
    },
    "dependencies": {
      "oneOf": [
        {
          "type": "array",
          "items": {
            "$ref": "#/$defs/DependencyRef"
          }
        },
        {
          "type": "null"
        }
      ]
    }
  },
  "required": [
    "schemaVersion",
    "catalog",
    "publisher",
    "release",
    "resources"
  ],
  "additionalProperties": false,
  "$defs": {
    "CatalogInfo": {
      "type": "object",
      "properties": {
        "slug": {
          "type": "string",
          "pattern": "^[a-z][a-z0-9]*(?:-[a-z0-9]+)*$",
          "minLength": 3,
          "maxLength": 50
        },
        "name": {
          "type": "string"
        },
        "description": {
          "type": [
            "string",
            "null"
          ]
        },
        "attributes": {
          "type": "array",
          "items": {
            "$ref": "#/$defs/AttributeAssignment"
          }
        },
        "keywords": {
          "oneOf": [
            {
              "type": "array",
              "items": {
                "$ref": "#/$defs/CatalogKeyword"
              },
              "maxItems": 20,
              "uniqueItems": true
            },
            {
              "type": "null"
            }
          ]
        },
        "presentation": {
          "oneOf": [
            {
              "$ref": "#/$defs/CatalogPresentation"
            },
            {
              "type": "null"
            }
          ]
        },
        "license": {
          "oneOf": [
            {
              "$ref": "#/$defs/CatalogLicense"
            },
            {
              "type": "null"
            }
          ]
        }
      },
      "required": [
        "slug",
        "name"
      ],
      "additionalProperties": false
    },
    "CatalogKeyword": {
      "description": "Lowercase ASCII letters and digits in hyphen-separated parts, at most 30 characters.",
      "type": "string",
      "minLength": 1,
      "maxLength": 30,
      "pattern": "^[a-z0-9]+(?:-[a-z0-9]+)*$"
    },
    "AttributeAssignment": {
      "type": "object",
      "properties": {
        "catalog": {
          "type": "string",
          "pattern": "^[a-z][a-z0-9]*(-[a-z0-9]+)*$"
        },
        "key": {
          "type": "string",
          "pattern": "^[a-z][a-z0-9]*(-[a-z0-9]+)*$"
        },
        "value": {
          "type": "string"
        }
      },
      "required": [
        "catalog",
        "key",
        "value"
      ],
      "additionalProperties": false
    },
    "CatalogPresentation": {
      "type": "object",
      "properties": {
        "iconAssetSlug": {
          "type": [
            "string",
            "null"
          ]
        },
        "imageAssetSlugs": {
          "type": "array",
          "items": {
            "type": "string"
          },
          "uniqueItems": true
        }
      },
      "additionalProperties": false
    },
    "CatalogLicense": {
      "type": "object",
      "properties": {
        "name": {
          "type": "string",
          "minLength": 1,
          "pattern": "^\\S(?:.*\\S)?$"
        },
        "spdxExpression": {
          "type": [
            "string",
            "null"
          ],
          "pattern": "^\\S(?:.*\\S)?$"
        },
        "url": {
          "type": [
            "string",
            "null"
          ],
          "pattern": "^https?://\\S+$"
        },
        "copyrightText": {
          "type": [
            "string",
            "null"
          ],
          "pattern": "^\\S(?:.*\\S)?$"
        }
      },
      "required": [
        "name"
      ],
      "additionalProperties": false
    },
    "PublisherInfo": {
      "type": "object",
      "properties": {
        "name": {
          "type": "string"
        },
        "url": {
          "type": [
            "string",
            "null"
          ]
        }
      },
      "required": [
        "name"
      ],
      "additionalProperties": false
    },
    "ReleaseInfo": {
      "type": "object",
      "properties": {
        "version": {
          "type": "string"
        },
        "releasedAt": {
          "type": [
            "string",
            "null"
          ]
        },
        "fingerprint": {
          "type": [
            "string",
            "null"
          ]
        }
      },
      "required": [
        "version"
      ],
      "additionalProperties": false
    },
    "CompatibilityInfo": {
      "type": "object",
      "properties": {
        "epistolaVersions": {
          "type": [
            "string",
            "null"
          ]
        }
      },
      "additionalProperties": false
    },
    "IncludeEntry": {
      "type": "object",
      "properties": {
        "url": {
          "type": "string"
        },
        "description": {
          "type": [
            "string",
            "null"
          ]
        }
      },
      "required": [
        "url"
      ],
      "additionalProperties": false
    },
    "ResourceEntry": {
      "type": "object",
      "properties": {
        "type": {
          "type": "string"
        },
        "slug": {
          "type": "string",
          "pattern": "^[a-z0-9]+(?:-[a-z0-9]+)*$",
          "minLength": 1,
          "maxLength": 64
        },
        "name": {
          "type": "string"
        },
        "description": {
          "type": [
            "string",
            "null"
          ]
        },
        "updatedAt": {
          "type": [
            "string",
            "null"
          ]
        },
        "detailUrl": {
          "type": "string"
        },
        "compatibility": {
          "oneOf": [
            {
              "$ref": "#/$defs/CompatibilityInfo"
            },
            {
              "type": "null"
            }
          ]
        }
      },
      "required": [
        "type",
        "slug",
        "name",
        "detailUrl"
      ],
      "additionalProperties": false
    },
    "DependencyRef": {
      "description": "Every dependency names a catalog from wire v7, so this is exactly CatalogDependencyRef.",
      "oneOf": [
        {
          "$ref": "#/$defs/CatalogDependencyRef"
        }
      ]
    },
    "CatalogDependencyRef": {
      "type": "object",
      "properties": {
        "type": {
          "enum": [
            "theme",
            "stencil",
            "codeList",
            "font",
            "image"
          ]
        },
        "catalogKey": {
          "type": "string",
          "pattern": "^[a-z][a-z0-9]*(?:-[a-z0-9]+)*$",
          "minLength": 3,
          "maxLength": 50
        },
        "slug": {
          "type": "string",
          "pattern": "^[a-z0-9]+(?:-[a-z0-9]+)*$",
          "minLength": 1,
          "maxLength": 64
        }
      },
      "required": [
        "type",
        "catalogKey",
        "slug"
      ],
      "additionalProperties": false
    }
  }
}
